burial,description,plot,url,birthdate,deathdate,name
"Burial: Fort Sam Houston National Cemetery San Antonio Bexar County Texas, USA ","US Air Force General. He entered the US Military Academy at West Point, New York in 1946 and graduated in 1950 with a 2nd lieutenant's commission and a bachelor of science degree. He entered the Air Force and attended pilot training at Vance Air Force Base, Oklahoma, received his pilot wings in 1951, and was assigned to James Connally Air Force Base, Texas (now closed) as a twin-engine pilot. He completed B-29 Superfortress combat crew training in October 1953 and was assigned to Okinawa, Japan, as a B-29 aircraft commander with the 307th and later the 19th Bombardment Wing. He returned to the United States with the 19th Bombardment Wing in June 1954, serving as a B-47 Stratojet aircraft commander and instructor pilot at Pinecastle/McCoy Air Force Base, Florida (now closed). He moved again with the 19th Bombardment Wing to Homestead Air Force Base, Florida (now an Air Force Reserve installation) in June 1956. In September 1961, he completed B-52 Stratofortress combat crew training and became a B-52H instructor pilot with the 93rd Bombardment Squadron at Kincheole Air Force Base, Michigan (now closed). In February 1964, he was selected to attend Armed Forces Staff College (now Joint Forces Staff College) at Norfolk, Virginia, and graduated in June 1964. He was then assigned to the headquarters of Strategic Air Command at Offutt Air Force Base, Nebraska, where he served as a requirements officer in the Aerospace Systems Branch, Plans Requirements Division. In 1966, he entered the National War College at Fort McNair, Washington DC, graduating in 1967, and also earned a master of science degree from George Washington University at the same time. He was assigned to Clark Air Base, Philippines in October 1967 as a B-57 Stratobomber pilot with the 13th Bombardment Squadron, which was later redesignated as Detachment 1, 8th Tactical Bombardment Squadron, and he then became its operations officer. During that time he flew over 350 hours on 142 combat missions over Vietnam. In August 1968 he returned to the United States and joined the Organization of the Joint Chiefs of Staff, Washington DC, serving in the Directorate of Operations as an operations officer and later as chief of the Current Operations Branch, Strategic Operations Division. Two years later he became the Air Force member of the Chairman's Staff Group, Office of the Chairman of the Joint Chiefs of Staff, Washington DC. In 1969, he attended the advanced management program at the Harvard Business School, Boston Massachusetts. In June 1972, he was transferred to Randolph Air Force Base, Texas, serving as the vice commander of the US Air Force Military Personnel Center, and assistant deputy chief of staff for military personnel, Headquarters US Air Force. In June 1974, he became the commander of the US Air Force Recruiting Service and deputy chief of staff, recruiting, for Air Training Command. In July 1975, he returned to Headquarters US Air Force, Washington DC, where he served as director, personnel plans, Office of the Deputy Chief of Staff, Personnel. In June 1977, he was named the deputy chief of staff, personnel (later manpower and personnel). He was promoted to the rank of general on 1 April 1979 and became the commander of Air Training Command at Randolph Air Force Base. In August 1981, he became the commander of Strategic Air Command, serving in that position until he retired on August 1, 1985, with 35 years of continued military service in the US Air Force. Among his military awards and decorations include the Air Force Distinguished Service Medal, the Silver Star, the Legion of Merit, the Distinguished Flying Cross with two oak leaf clusters, the Bronze Star, the Air Medal with seven oak leaf clusters, the Joint Service and Air Force Commendation Medals, the Presidential Unit Citation, and the Air Force Outstanding Unit Award. He was a command pilot with over 9,000 flying hours in various bomber aircraft. He died of natural causes. (bio by:  William Bjornstad) Family links: Spouse:  Patricia Ann Davis (1930 - 2006) ",Plot: Section CJJ Site 7 ,http://www.findagrave.com/cgi-bin/fg.cgi?GRid=97829320&page=gr,"May 12,  1928 McAlester Pittsburg County Oklahoma, USA ","Sep. 23,  2012 Georgetown Williamson County Texas, USA ",Gen Bennie Luke Davis
"Burial: San Jose Burial Park San Antonio Bexar County Texas, USA ","Journalist. She was well-known for her column ""Hints From Heloise"" from 1962 to 1977. She helped people with everyday problems to the right out bizarre. At the time the column ran, it was in over 600 newspapers worldwide. Family links: Parents:  Charles Louis Bowles (1899 - 1971)  Amelia  Harrison  Bowles (1901 - 1973) Spouse:  Marshal Holman Cruse (1920 - 2006) Sibling:  Elizabeth Louise  Bowles  Matlock (1919 - 1981)  Heloise  Bowles  Cruse (1919 - 1977) Calculated relationship ","Plot: Block 4, Section 2, Lot 12, Grave 1 ",http://www.findagrave.com/cgi-bin/fg.cgi?GRid=6814347&page=gr,"May 4,  1919 Fort Worth Tarrant County Texas, USA ","Dec. 28,  1977 San Antonio Bexar County Texas, USA ",Heloise <i>Bowles</i> Cruse
"Burial: San Fernando Cathedral San Antonio Bexar County Texas, USA ","Folk Figure, Frontiersman, Soldier, US Congressman, and Defender of the Alamo. Commonly referred to as the ""King of the Wild Frontier,"" his exploits as an American folk hero were popularized in films, stage plays, and books, which were often exaggerated. Born in present-day Greene County, Tennessee near Limestone, his father struggled to make ends meet. As a young boy, he had to work to help pay his father's debts and would often tend cattle for local farmers. In 1806 he married Polly Finley and they moved several times before he signed up as a scout and forager for the local militia in September 1813 during the Creek War. The following year he participated in a military expedition in Spanish Florida and returned home in December 1814. After relocating to Lawrence County, Tennessee, he first entered politics, serving as a county commissioner and justice of the peace. In 1818 he was elected as a lieutenant colonel of the 57th Tennessee Militia and was soon engaged in several local business ventures. In 1821 he resigned as commissioner and was elected to the Tennessee Legislature and was re-elected two years later. In 1825 he ran as a National Republican and lost for a seat for Tennessee's 9th district in the US House of Representatives but won the following year, serving for two terms from March 1827 until March 1831. He voted against President Andrew Jackson's 1830 Indian Removal Act which made him unpopular with his constituents and he lost his seat in the 1830 election. In 1832 he ran for the US House of Representatives from Tennessee's newly created 12th district and was elected, defeating his former opponent William Fitzgerald, serving one term from March 1833 until March 1835. During this last term, he had expressed a desire about moving to Texas, and in November 1835, he assembled a group of volunteers and led them to the Alamo mission in present-day San Antonio, Texas where, on February 8, 1836, he joined up with the legendary James Bowie and Alamo commander Lieutenant Colonel William Barret Travis. They encountered a force of about 1,800 Mexican soldiers under the command of General Antonio Lopez de Santa Anna. With only about 185 to 260 men, the Alamo defenders managed to hold off the Mexican Army for 13 days until they were finally overrun on March 6, 1836 and Crockett died either in combat or was executed at the age of 49. Historians disagree on how he died, as there are several accounts of his death that cannot be accurately verified. Over the years, his character has been portrayed in numerous films and television programs, including Jack Perrin in ""The Painted Stallion"" (1937), Robert Barrat in ""Man of Conquest"" (1939), Arthur Hunnicutt in ""The Last Command"" (1955), Fess Parker in ""Davy Crockett, King of the Wild Frontier"" (1955) and ""Davy Crockett and the River Pirates"" (1956), John Wayne in ""The Alamo"" (1960), Brian Keith in ""The Alamo: 13 Days to Glory"" (1987), Johnny Cash in ""Davy Crockett: Rainbow in the Thunder"" (1988), John Schneider in James A. Michener's ABC television miniseries ""Texas"" (1994), and Billy Bob Thornton in ""The Alamo"" (2004). The song ""The Ballad of Davy Crockett"" sung by Bill Hayes and written for the ABC television miniseries ""Davy Crockett"" that aired from 1954 to 1955, reached No. 1 on the Billboard charts from March to April 1955. In addition to his burial location at the San Fernando Cathedral in San Antonio, Texas, a cenotaph resides at his birthplace in Limestone Springs, Tennessee. A life-size statue in his honor resides at the Lawrenceburg Public Square in Lawrenceburg, Tennessee. (bio by:  William Bjornstad) Family links: Parents:  John B Crockett (1759 - 1834)  Rebecca  Hawkins  Crockett (1756 - 1832) Spouses:  Mary  Finley  Crockett (1788 - 1815)  Elizabeth  Patton  Crockett (1788 - 1860) Children:  John Wesley Crockett (1807 - 1852)  William Finley Crockett (1809 - 1846)  Margaret Finley  Crockett  Flowers (1812 - 1860)  Robert Patton Crockett (1816 - 1889)  Rebecca E  Crockett  Halford (1818 - 1879)  Elizabeth Jane  Crockett  Whitehurst (1818 - 1895)  Matilda  Crockett  Fields (1821 - 1890) Siblings:  William Crockett (1782 - 1858)  David Stern Crockett (1786 - 1836)  John Crockett (1787 - 1840)  Benjamin Franklin Ellis (1797 - 1877) ** Calculated relationship **Half-sibling Inscription: Here Lie the Remains of Travis, Crockett, Bowie and Other Alamo Heroes Formerly buried in the sanctuary of the Old San Fernando Church. Exhumed July 28, 1936. Exposed to public view for a year. Entombed May 11, 1938 The Archdiocese of San Antonio erected this memorial May 11 A.D. 1938 R.I.P ","Maintained by: Find A Grave Record added: Jan 01, 2001",http://www.findagrave.com/cgi-bin/fg.cgi?GRid=2308&page=gr,"Aug. 17,  1786 Greene County Tennessee, USA ","Mar. 6,  1836 San Antonio Bexar County Texas, USA ","David Stern ""Davy"" Crockett"
"Burial: Fort Sam Houston National Cemetery San Antonio Bexar County Texas, USA ","Actor. As Linc Case, he replaced George Maharis (Buz Murdock) as Martin  Milner's ""Route 66"" co-star during the series's fourth and final season (1963-64). Other regular TV roles were as 'Wes Macauley' in ""It's a Man's World"" (1962-63), 'Chance Reynolds' in ""The Road West"" (1966-67), and 'Paul Morgan' in ""Dallas"" (1983-84). When his ""Dallas"" character was written out of the series, he stayed with the production company, Lorimar, for three more years as its dialogue director. Films include ""All the Young Men,"" with Alan Ladd and Sidney Poitier, ""The Mountain Road"" and ""Shenandoah,"" both with James Stewart, ""Chisum"" and ""Big Jake,"" both with John Wayne, and ""Midway"" with Charlton Heston and Henry Fonda. Cause of death: Lung cancer Note: CM3, US Navy, Korea ",Plot: Section Q Site 138-AM ,http://www.findagrave.com/cgi-bin/fg.cgi?GRid=522673&page=gr,"Aug. 17,  1933 El Monte Los Angeles County California, USA ","Jan. 16,  1993 San Antonio Bexar County Texas, USA ",Glenn Corbett
"Burial: Sunset Memorial Park San Antonio Bexar County Texas, USA ","Artist. Nationally known sculptor who sculptured the Alamo Cenotaph, busts of many famous Texans, Confederates, and other Americans. In all, he is represented in the United States by thirty-six public monuments, sixteen portrait statues, and about seventy-five portrait busts. Family links: Spouse:  Elizabeth  di  Barbieri  Coppini (1875 - 1957) Calculated relationship ",Plot: Rose Arbor ,http://www.findagrave.com/cgi-bin/fg.cgi?GRid=18170&page=gr,"May 19,  1870 ","Sep. 26,  1957 ",Pompeo Coppini
"Burial: City Cemetery #1 San Antonio Bexar County Texas, USA ","US Air Force Lieutenant General. A World War II veteran, he rose in rank to become the US Air Force Assistant Vice Chief of Staff. Born in Fort Payne, Alabama he graduated from DeKalb County High School there in 1936 and entered the University of Alabama at Tuscaloosa, Alabama. Shortly afterward, he received an appointment to attend the US Military Academy at West Point, New York and graduated in 1941, and joined the US Army Air Corps. After the US entered World War II in December 1941, he was assigned to the China-Burma-India Theater of Operations the following May 1942 and for the next three and one-half years he served in various air depot assignments, and was involved in planning and executing airborne resupply operations over the Himalayan Mountains to Chinese Nationalist and other Allied forces, commonly known as ""The Hump"" operation. He became group commander of the Southern India Air Depot, a unit associated with Hindustan Aircraft Limited, one of the largest aircraft materiel support facilities outside the US, and worked with both Indian and British units to assure unified support of Allied operations. In September 1945 he returned to the US and was assigned to the US Army Air Forces Headquarters in Washington DC, where he served in the Office of the Assistant Chief of Staff for Personnel. From February to May 1946 he attended the Army Command and General Staff School at Fort Leavenworth, Kansas and the following November he went to Harvard University at Cambridge, Massachusetts to attend the Graduate School of Business Administration and earned his Master's Degree in Business Administration in March 1948. He was then assigned as a member of the Munitions Board in Office of the Secretary of Defense, Washington DC, where he worked on various mobilization planning studies and on measures to improve defense-wide procurement and supply practices. In July 1952 he was assigned to Wright-Patterson Air Force Base, Ohio, to serve in Headquarters Air Materiel Command (now Air Force Material Command) as Chief of the Plans and Programs Division. In February 1954 he was assigned to a short tour with the 5th Air Force in Korea where he served as deputy comptroller and later as comptroller, and in November 1954 he returned to the US to serve as comptroller for the Central Air Defense Force now inactivated) at Richards-Gebaur Air Force Base, Missouri (now closed). In August 1957 he entered the Air War College at Maxwell Air Force Base, Alabama, graduating in June 1958, and became Deputy Chief of the Plans and Programs Division, Directorate of Budget, Headquarters US Air Force in Washington DC, and in 1960 he became its Deputy Director of Budget. In February 1963 he was named Comptroller for the Air Force Systems Command (now combined with Air Force Material Command at Wright-Patterson Air Force Base, Ohio) at Andrews Air Force Base, Maryland. The following year he returned to Headquarters US Air Force as the Director of Budget in the Comptroller Directorate and in March 1969 he was appointed the Air Force Comptroller with collateral duty as chairman, Board of Directors, Army/Air Force Exchange Service. In October 1973 he was promoted to the rank of lieutenant general and became Assistant US Air Force Vice Chief of Staff, and retired in this position in August 1974, with 33 years of continuous military service. Among his military awards and decorations include the Distinguished Service Medal, the Legion of Merit, the Bronze Star Medal, the Army Commendation Medal, the World War II Victory Medal, the Asiatic-Pacific Campaign Medal, and the National Defense Service Medal. After his military retirement, he became the Associate Deputy Administrator of the National Aeronautics and Space Administration (NASA) in 1975 and in 1978 he was awarded the NASA Distinguished Service Medal. He died in San Antonio, Texas at the age of 78. (bio by:  William Bjornstad) Family links: Spouse:  Eleanor Stribling  Dance  Crow (1925 - 1994) Inscription: Pete, Lt. Gen, USAF-UFMA41 ","Maintained by: Find A Grave Originally Created by:  Beth Sanders Record added: Oct 24, 2006",http://www.findagrave.com/cgi-bin/fg.cgi?GRid=16304520&page=gr,"Jun. 26,  1919 ","Oct. 27,  1997 ",Gen Duward Lowery Crow
"Burial: Fort Sam Houston National Cemetery San Antonio Bexar County Texas, USA ","United States Army Major General. Born in Muskegon, Michigan, he enlisted in the Quartermaster Corps Reserve in 1917, was commissioned a Second Lieutenant in August 1918 and served in World War I. After the war, he graduated flying school in 1922, was transferred to the US Air Service and served as a flight instructor. In 1925, he became engineering officer at the San Antonio, Texas Depot and was an engineering officer for the Philippine Air Depot, 1928 to 1930. Promoted Brigadier General in 1942, he served as commander of America's state side operations of the 2nd Air Force's Tactical forces and 73rd Bomber Wing during World War II. In August 1945, he was assigned to the Far East Air Forces, 5th Air Force Service Command in Japan. Promoted Major General in 1946, he became commander of the 7th Air Service Area Command in Japan and assumed command of the air depot at Hickam Field, Hawaii in 1947. Returning to the United States in 1950, he served as chief of the Maintenance Division, Directorate of Supply and Maintenance, Air Materiel Command at Wright-Patterson, Air Force Base, Ohio, until retiring from active service in June 1952. He died in Boerne, Texas. (bio by:  John ""J-Cat"" Griffith) Family links: Spouse:  Olga M Chapman (1904 - 1990) Calculated relationship ",Plot: Section PC Site 110-H ,http://www.findagrave.com/cgi-bin/fg.cgi?GRid=9792&page=gr,"Aug. 27,  1895 Michigan, USA ","Jun. 7,  1969 Kendall County Texas, USA ",MG Thomas Herbert Chapman
"Burial: Holy Cross Cemetery San Antonio Bexar County Texas, USA ","Professional Wrestler. He was known by the ring names ""Cowboy"" Cade, ""Garrison"" Cade, and most notably as Lance Cade. After excelling in basketball at Millard North High School, in Omaha, Nebraska, he turned down offers from several collages to pursue his aspirations of becoming a professional wrestler. He was trained at the Shawn Michaels Wrestling Academy in San Antonio, Texas. Cade made his professional debut in Japan in 1999 and in 2001 he signed with what was then the World Wrestling Federation (WWF). He was sent to Memphis Championship Wrestling (MCW), which was a part of the WWF, and later that year he was once again relocated to the Heartland Wrestling Association (HWA), a developmental territory for the WWF. In 2002 Cade left HWA. He was then sent to Ohio Valley Wrestling (OVW). In 2003 he was finally brought up to the WWF, using the name ""Garrison"" Cade. His first match was with Lance Storm. Later he formed a tag team with Mark Jindrak, and began their quest for the tag team titles. In 2004 Jindrak was drafted to Smackdown, so the team was split. Due to a knee injury Cade was off television for quite some time.  In August of 2005 he returned with a new look and a new partner, Trevor Murdoch,  and together they would hold the tag team titles on 3 occasions.  In October 2008, Cade was released from the WWE because he had a seizure on an airplane which required immediate medical care. In December of 2008, he returned to Japan and once again teamed with Murdoch.  In 2009 he rejoined the WWE but was once again released when he asked for help with a sleeping pill addiction.  He did complete a 30-day rehabilitation program. During his 11-year career Cade held the HWA Tag titles 3 times, the HWA Heavyweight title 2 times, The Texas Wrestling Allience heaveyweight title 1 time and the WWE tag titles 3 times.  Cade died of heart failure in his sleep,  while visiting his father in San Antonio,  Texas. He was 29 years old. (bio by:  Hilda Duell) ","Maintained by: Find A Grave Originally Created by:  Hilda Duell Record added: Aug 20, 2010",http://www.findagrave.com/cgi-bin/fg.cgi?GRid=57372283&page=gr,"Mar. 2,  1981 Carroll Carroll County Iowa, USA ","Aug. 13,  2010 San Antonio Bexar County Texas, USA ",Lance Cade
"Burial: Fort Sam Houston National Cemetery San Antonio Bexar County Texas, USA ","US Air Force Lieutenant General. A highly decorated combat bomber pilot in World War II, he rose in rank to become the US Air Force Assistant Vice Chief of Staff. Born John Wilson Carpenter in Starkville, Mississippi, he studied engineering at Oklahoma A&amp;M University in Stillwater, Oklahoma and Mississippi State College (now Mississippi State University) in Starkville, Mississippi before being selected to attend the US Military Academy at West Point, New York in 1935, where he graduated with a Bachelor of Science degree in Military Science in 1939 and received his commission as a 2nd lieutenant. He attended the US Army Air Corps flying schools at Tulsa, Oklahoma, Randolph Field (now Randolph Air Force Base, a part of Joint Base San Antonio), Texas and Kelly Field (now Kelly Air Reserve Base, also a part of Joint Base San Antonio), Texas, and received his pilot wings in June 1940. His first assignment was with the 19th Bombardment Group at March Field (now March Air Reserve Base), California, where he served as a heavy bombardment pilot, navigator and bombardier. In May 1941 he participated in the first mass flight of B-17 Flying Fortress bomber aircraft from Hamilton Field, California, to Hickam Field (now Hickam Air Force Base, a part of Joint Base Pearl Harbor-Hickam), Hawaii. In October 1941 he was assigned to Clark Field (now closed) in the Philippine Islands, where he served as squadron intelligence officer and combat crew commander. When the Japanese attacked Clark Field on December 8, 1941, he was airborne on a reconnaissance mission. After surviving several passes made by Japanese fighter aircraft, he maneuvered to avoid contact until the attack on Clark Field had ended. The following day he flew the first reconnaissance mission to Formosa (now Taiwan) and was forced to abort the mission due to generator problems. After flying several missions against the Japanese forces, he was ordered to Bataan where he commanded the ground echelon of the 19th Bombardment Group. He served with the Infantry for two months before being evacuated to Java by submarine and rejoined his unit, and flew combat missions in the Netherlands East Indies, the Battle of the Coral Sea, Papua New Guinea, and Rabaul, New Britain campaigns until the 19th Bombardment Group returned to the US in December 1942. He then served on tours of duty at Eglin Field (now Eglin Air Force Base), Florida, Headquarters US Army Air Forces Bombardment Training Division, Washington DC, and Headquarters 20th Air Force in Washington and the Mariana Islands. During the latter days of World War II, he played an important part in getting the B-29 Superfortress bomber aircraft ready for combat duties. After the end of World War II, he attended the Air Command and Staff College at Maxwell Air Force Base, Alabama as a student and then instructor, performed a tour in the Philippine Islands, first as commander, 5th Reconnaissance Group, and later as vice commander of 13th Air Force. In 1951 he was transferred to the headquarters of Air Research and Development Command (now Air Force Systems Command) at Baltimore, Maryland. After returning to Maxwell Air Force Base to attend the Air War College in July 1954, he became vice commander of Arnold Engineering Development Center at Arnold Air Force Station (now Arnold Air Force Base) at Tullahoma, Tennessee. In March 1955 he returned to Air Research and Development Command headquarters and later became its Chief of Plans and Programs. In March 1959 he became the commander of the Air Force Flight Test Center at Edwards Air Force Base, California and in July 1961 he was assigned to Headquarters US Air Force in Washington, DC where he first served as Deputy Director of Plans, and then as Director of Plans and in July 1964 he became the Assistant Deputy Chief of Staff for Plans and Operations (Joint Chiefs of Staff Matters). In August 1965 he was appointed commander of the Air University at Maxwell Air Force Base, where he served until July 1968 when he returned to Headquarters US Air Force as Deputy Chief of Staff, Personnel. The following year he was promoted to the rank of lieutenant general and became Assistant Vice Chief of Staff, US Air Force in Washington DC, with additional duty as Senior Air Force Member to the Military Staff Committee, United Nations, and retired in these positions with 31 years of continuous military service. Among his military decorations and awards include the Air Force Distinguished Service Medal with 1 oak leaf cluster, the Silver Star with 2 oak leaf clusters, the Legion of Merit with 2 oak leaf clusters, the Distinguished Flying Cross with 2 oak leaf clusters, the Air Medal with 1 oak leaf cluster, the American Defense Service Medal, the American Campaign Medal, the Asiatic-Pacific Campaign Medal with 5 service stars, the World War II Victory Medal, and the National Defense Service Medal. After his military retirement, he served as the superintendent of Culver Military Academy at Culver, Indiana until 1974. He died in San Antonio, Texas at the age of 80. (bio by:  William Bjornstad) Family links: Spouse:  Dorothy G Carpenter (1918 - 2004) Inscription: Silver Star  &amp; 2 OLC DSM Note: LT GEN US Air Force, World War II, Korea, Vietnam ",Plot: Section 14A Site 579-Q ,http://www.findagrave.com/cgi-bin/fg.cgi?GRid=467460&page=gr,"Aug. 11,  1916 Starkville Oktibbeha County Mississippi, USA ","Nov. 8,  1996 San Antonio Bexar County Texas, USA ","LTG John W. Carpenter, III"
